{
  "$schema": "https://json-schema.org/draft/2020-12/schema",
  "title": "news_post",
  "type": "object",
  "required": ["type", "date", "title", "body_markdown"],
  "properties": {
    "type": { "const": "news_post" },
    "date": { "type": "string", "pattern": "^\\d{4}-\\d{2}-\\d{2}$" },
    "title": { "type": "string", "minLength": 3 },
    "slug": { "type": "string" },
    "body_markdown": { "type": "string", "minLength": 1 },
    "description": { "type": "string" },
    "show_on_homepage": { "type": "boolean" },
    "tags": { "type": "array", "items": { "type": "string" } },
    "featured_slide": {
      "type": "object",
      "properties": {
        "image": { "type": "string" },
        "title": { "type": "string" },
        "caption": { "type": "string" },
        "link": { "type": "string" }
      },
      "required": ["image", "title"]
    }
  },
  "additionalProperties": true
}
